<?xml version="1.0" encoding="UTF-8"?>
<xs:schema xmlns:xs="http://www.w3.org/2001/XMLSchema">
    <xs:element name="expenseSystem">
        <xs:complexType>
            <xs:sequence>
                <xs:element name="expense" maxOccurs="unbounded" minOccurs="0">
                    <xs:complexType>
                        <xs:sequence>
                            <xs:element name="date" type="xs:date"/>
                            <xs:element name="item" type="xs:string"/>
                            <xs:element name="category" type="xs:string"/>
                            <xs:element name="payment" type="xs:string"/>
                            <xs:element name="amount" type="xs:decimal"/>
                        </xs:sequence>
                    </xs:complexType>
                </xs:element>
            </xs:sequence>
        </xs:complexType>
    </xs:element>
</xs:schema>
