<?xml version="1.0" encoding="UTF-8"?>
<?xml-stylesheet type="text/xsl" href="expenses.xsl"?>
<expenseSystem xmlns:xsi="http://w3.org"
               xsi:noNamespaceSchemaLocation="expenses.xsd">
    <expense>
        <date>2026-08-25</date>
        <item>Groceries</item>
        <category>Food</category>
        <payment>Credit Card</payment>
        <amount>150.00</amount>
    </expense>
    <expense>
        <date>2026-08-26</date>
        <item>Electric Bill</item>
        <category>Utilities</category>
        <payment>Debit Card</payment>
        <amount>120.00</amount>
    </expense>
    <expense>
        <date>2026-08-27</date>
        <item>Movie Ticket</item>
        <category>Entertainment</category>
        <payment>Cash</payment>
        <amount>15.00</amount>
    </expense>
</expenseSystem>
